repo_full_name,html_url,description,homepage,topics,archived,disabled,is_fork,license_spdx,language,stars,forks,watchers,open_issues,size_kb,created_at,updated_at,pushed_at,days_since_last_commit,days_since_last_update,risk_score,action,risk_flags,why,updated_at_run
open-mmlab/mmdetection,https://github.com/open-mmlab/mmdetection,OpenMMLab Detection Toolbox and Benchmark,https://mmdetection.readthedocs.io,"cascade-rcnn,convnext,detr,fast-rcnn,faster-rcnn,glip,grounding-dino,instance-segmentation,mask-rcnn,object-detection,panoptic-segmentation,pytorch,retinanet,rtmdet,semisupervised-learning,ssd,swin-transformer,transformer,vision-transformer,yolo",0,0,0,Apache-2.0,Python,32370,9849,32370,1952,64771,2018-08-22T07:06:06Z,2026-02-05T10:44:53Z,2024-08-21T02:01:07Z,533,0,60,CAUTION,NO_COMMIT_365D|ISSUE_PRESSURE_MED,No commits for 533 days and high open issue count of 1952 indicates low maintenance and potential support challenges.,2026-02-05T11:55:10.885479+00:00
YMFE/yapi,https://github.com/YMFE/yapi,YApi æ˜¯ä¸€ä¸ªå¯æœ¬åœ°éƒ¨ç½²çš„ã€æ‰“é€šå‰åç«¯åŠQAçš„ã€å¯è§†åŒ–çš„æ¥å£ç®¡ç†å¹³å°,http://yapi.smart-xwork.cn/,"api,api-management,api-manager,api-test",0,0,0,Apache-2.0,JavaScript,27764,4843,27764,1620,232820,2016-05-30T09:09:09Z,2026-02-05T07:52:31Z,2024-08-12T09:29:34Z,542,0,60,CAUTION,NO_COMMIT_365D|ISSUE_PRESSURE_MED,"No commits for 542 days with 1620 open issues, suggesting the project is not actively maintained and has unresolved problems.",2026-02-05T11:55:11.253961+00:00
nylas/nylas-mail,https://github.com/nylas/nylas-mail,:love_letter: An extensible desktop mail app built on the modern web.  Forks welcome!,https://nylas.com/nylas-mail/,"babel,electron,email,flux,javascript,linux,macos,nylas-mail,productivity,react,windows",0,0,0,MIT,JavaScript,24803,1365,24803,1003,87026,2014-10-16T18:29:12Z,2026-02-04T21:25:04Z,2022-11-24T08:20:57Z,1169,0,60,CAUTION,NO_COMMIT_365D|ISSUE_PRESSURE_MED,"No commits for 1169 days, indicating the project is likely abandoned despite having 24803 stars.",2026-02-05T11:55:11.375828+00:00
fighting41love/funNLP,https://github.com/fighting41love/funNLP,ä¸­è‹±æ–‡æ•æ„Ÿè¯ã€è¯­è¨€æ£€æµ‹ã€ä¸­å¤–æ‰‹æœº/ç”µè¯å½’å±åœ°/è¿è¥å•†æŸ¥è¯¢ã€åå­—æ¨æ–­æ€§åˆ«ã€æ‰‹æœºå·æŠ½å–ã€èº«ä»½è¯æŠ½å–ã€é‚®ç®±æŠ½å–ã€ä¸­æ—¥æ–‡äººååº“ã€ä¸­æ–‡ç¼©å†™åº“ã€æ‹†å­—è¯å…¸ã€è¯æ±‡æƒ…æ„Ÿå€¼ã€åœç”¨è¯ã€ååŠ¨è¯è¡¨ã€æš´æè¯è¡¨ã€ç¹ç®€ä½“è½¬æ¢ã€è‹±æ–‡æ¨¡æ‹Ÿä¸­æ–‡å‘éŸ³ã€æ±ªå³°æ­Œè¯ç”Ÿæˆå™¨ã€èŒä¸šåç§°è¯åº“ã€åŒä¹‰è¯åº“ã€åä¹‰è¯åº“ã€å¦å®šè¯åº“ã€æ±½è½¦å“ç‰Œè¯åº“ã€æ±½è½¦é›¶ä»¶è¯åº“ã€è¿ç»­è‹±æ–‡åˆ‡å‰²ã€å„ç§ä¸­æ–‡è¯å‘é‡ã€å…¬å¸åå­—å¤§å…¨ã€å¤è¯—è¯åº“ã€ITè¯åº“ã€è´¢ç»è¯åº“ã€æˆè¯­è¯åº“ã€åœ°åè¯åº“ã€å†å²åäººè¯åº“ã€è¯—è¯è¯åº“ã€åŒ»å­¦è¯åº“ã€é¥®é£Ÿè¯åº“ã€æ³•å¾‹è¯åº“ã€æ±½è½¦è¯åº“ã€åŠ¨ç‰©è¯åº“ã€ä¸­æ–‡èŠå¤©è¯­æ–™ã€ä¸­æ–‡è°£è¨€æ•°æ®ã€ç™¾åº¦ä¸­æ–‡é—®ç­”æ•°æ®é›†ã€å¥å­ç›¸ä¼¼åº¦åŒ¹é…ç®—æ³•é›†åˆã€bertèµ„æºã€æ–‡æœ¬ç”Ÿæˆ&æ‘˜è¦ç›¸å…³å·¥å…·ã€cocoNLPä¿¡æ¯æŠ½å–,https://zhuanlan.zhihu.com/yangyangfuture,,0,0,0,,Python,78853,15140,78853,44,174188,2018-08-21T11:20:39Z,2026-02-05T10:55:49Z,2024-05-10T07:38:24Z,636,0,55,CAUTION,LICENSE_UNCLEAR|NO_COMMIT_365D,"No commits for 636 days and unclear license, posing legal and maintenance risks despite 78853 stars.",2026-02-05T11:55:10.518047+00:00
resume/resume.github.com,https://github.com/resume/resume.github.com,Resumes generated using the GitHub informations,https://resume.github.com,,0,0,0,,JavaScript,62790,1360,62790,71,411,2011-02-06T13:39:55Z,2026-02-05T08:29:23Z,2023-02-15T06:38:51Z,1086,0,55,CAUTION,LICENSE_UNCLEAR|NO_COMMIT_365D,"No commits for 1086 days and unclear license, indicating abandonment and potential legal uncertainty.",2026-02-05T11:55:11.008446+00:00
meta-llama/llama,https://github.com/meta-llama/llama,Inference code for Llama models,,,0,0,0,NOASSERTION,Python,59114,9829,59114,512,1150,2023-02-14T09:29:12Z,2026-02-05T11:39:27Z,2025-01-26T21:42:26Z,374,0,55,CAUTION,LICENSE_UNCLEAR|NO_COMMIT_365D,"No commits for 374 days and unclear license (NOASSERTION), raising maintenance and legal concerns.",2026-02-05T11:55:10.639861+00:00
lencx/ChatGPT,https://github.com/lencx/ChatGPT,"ğŸ”® ChatGPT Desktop Application (Mac, Windows and Linux)",,"ai,app,application,chatgpt,desktop-app,gpt,gpt-3,linux,macos,notes-app,openai,rust,tauri,webview,windows",0,0,0,,Rust,54393,6223,54393,918,32499,2022-12-07T09:43:02Z,2026-02-05T09:13:42Z,2024-08-29T17:58:11Z,524,0,55,CAUTION,LICENSE_UNCLEAR|NO_COMMIT_365D,"No commits for 524 days and unclear license, suggesting inactivity and legal ambiguity.",2026-02-05T11:55:12.480350+00:00
NARKOZ/hacker-scripts,https://github.com/NARKOZ/hacker-scripts,Based on a true story,,,0,0,0,,JavaScript,49408,6680,49408,68,105,2015-11-21T19:05:09Z,2026-02-05T01:17:19Z,2023-10-23T21:01:40Z,835,0,55,CAUTION,LICENSE_UNCLEAR|NO_COMMIT_365D,"No commits for 835 days and unclear license, indicating the project is not maintained.",2026-02-05T11:55:11.009293+00:00
apachecn/ailearning,https://github.com/apachecn/ailearning,AiLearningï¼šæ•°æ®åˆ†æ+æœºå™¨å­¦ä¹ å®æˆ˜+çº¿æ€§ä»£æ•°+PyTorch+NLTK+TF2,http://ailearning.apachecn.org/,"adaboost,apriori,deeplearning,dnn,fp-growth,kmeans,logistic,lstm,mahchine-leaning,naivebayes,nlp,pca,python,recommendedsystem,regression,rnn,scikit-learn,sklearn,svd,svm",0,0,0,NOASSERTION,Python,42023,11613,42023,3,171378,2017-02-25T08:53:02Z,2026-02-05T11:51:07Z,2024-11-12T16:21:55Z,449,0,55,CAUTION,LICENSE_UNCLEAR|NO_COMMIT_365D,"No commits for 449 days and unclear license (NOASSERTION), posing legal and maintenance risks.",2026-02-05T11:55:10.762110+00:00
floodsung/Deep-Learning-Papers-Reading-Roadmap,https://github.com/floodsung/Deep-Learning-Papers-Reading-Roadmap,Deep Learning papers reading roadmap for anyone who are eager to learn this amazing tech!,,deep-learning,0,0,0,,Python,39465,7334,39465,91,3638,2016-10-14T11:49:48Z,2026-02-05T01:23:35Z,2022-11-27T13:18:32Z,1165,0,55,CAUTION,LICENSE_UNCLEAR|NO_COMMIT_365D,"No commits for 1165 days and unclear license, indicating the resource is outdated and legally unclear.",2026-02-05T11:55:10.762837+00:00
TencentARC/GFPGAN,https://github.com/TencentARC/GFPGAN,GFPGAN aims at developing Practical Algorithms for Real-world Face Restoration.,,"deep-learning,face-restoration,gan,gfpgan,image-restoration,pytorch,super-resolution",0,0,0,NOASSERTION,Python,37379,6280,37379,398,5467,2021-03-19T06:18:20Z,2026-02-05T08:17:08Z,2024-07-26T18:44:02Z,558,0,55,CAUTION,LICENSE_UNCLEAR|NO_COMMIT_365D,"No commits for 558 days and unclear license (NOASSERTION), raising concerns about ongoing development and legal use.",2026-02-05T11:55:10.763303+00:00
openai/gym,https://github.com/openai/gym,A toolkit for developing and comparing reinforcement learning algorithms.,https://www.gymlibrary.dev,,0,0,0,NOASSERTION,Python,37010,8710,37010,127,7123,2016-04-27T14:59:16Z,2026-02-05T08:36:38Z,2024-10-11T20:07:05Z,481,0,55,CAUTION,LICENSE_UNCLEAR|NO_COMMIT_365D,"No commits for 481 days and unclear license (NOASSERTION), suggesting inactivity and licensing uncertainty.",2026-02-05T11:55:10.763439+00:00
XingangPan/DragGAN,https://github.com/XingangPan/DragGAN,Official Code for DragGAN (SIGGRAPH 2023),https://vcai.mpi-inf.mpg.de/projects/DragGAN/,"artificial-intelligence,generative-adversarial-network,generative-models,image-manipulation",0,0,0,NOASSERTION,Python,35978,3443,35978,154,34847,2023-05-18T10:08:02Z,2026-02-04T07:47:13Z,2024-05-18T17:51:40Z,627,1,55,CAUTION,LICENSE_UNCLEAR|NO_COMMIT_365D,"No commits for 627 days and unclear license (NOASSERTION), indicating stalled development and legal risk.",2026-02-05T11:55:10.763939+00:00
jondot/awesome-react-native,https://github.com/jondot/awesome-react-native,"Awesome React Native components, news, tools, and learning material!",http://www.awesome-react-native.com,"awesome-list,mobile,react,react-native",0,0,0,,JavaScript,35601,4026,35601,101,5250,2015-03-26T19:58:06Z,2026-02-05T08:17:55Z,2024-07-05T13:12:41Z,579,0,55,CAUTION,LICENSE_UNCLEAR|NO_COMMIT_365D,"No commits for 579 days and unclear license, meaning the curated list is outdated and lacks clear licensing.",2026-02-05T11:55:11.131400+00:00
unknwon/the-way-to-go_ZH_CN,https://github.com/unknwon/the-way-to-go_ZH_CN,ã€ŠThe Way to Goã€‹ä¸­æ–‡è¯‘æœ¬ï¼Œä¸­æ–‡æ­£å¼åã€ŠGo å…¥é—¨æŒ‡å—ã€‹,,"book,go,translation,tutorial",0,0,0,,Go,35170,8580,35170,47,12602,2013-03-24T17:18:38Z,2026-02-04T16:40:03Z,2024-08-14T07:04:25Z,540,0,55,CAUTION,LICENSE_UNCLEAR|NO_COMMIT_365D,"No commits for 540 days and unclear license, suggesting the translation is no longer maintained and legally ambiguous.",2026-02-05T11:55:11.990964+00:00
chenfei-wu/TaskMatrix,https://github.com/chenfei-wu/TaskMatrix,,,,0,0,0,NOASSERTION,Python,34281,3255,34281,256,41169,2023-03-02T09:04:28Z,2026-02-05T03:45:33Z,2024-01-06T02:41:20Z,761,0,55,CAUTION,LICENSE_UNCLEAR|NO_COMMIT_365D,"No commits for 761 days and unclear license (NOASSERTION), indicating inactivity and licensing concerns.",2026-02-05T11:55:10.764329+00:00
shadowsocks/shadowsocks,https://github.com/shadowsocks/shadowsocks,,,,0,0,0,,Python,33640,18305,33640,451,891,2012-04-20T13:10:49Z,2026-02-04T11:31:46Z,2024-04-01T09:07:32Z,675,1,55,CAUTION,LICENSE_UNCLEAR|NO_COMMIT_365D,"No commits for 675 days and unclear license, raising significant maintenance and legal usage questions.",2026-02-05T11:55:10.885024+00:00
donnemartin/interactive-coding-challenges,https://github.com/donnemartin/interactive-coding-challenges,120+ interactive Python coding interview challenges (algorithms and data structures).  Includes Anki flashcards.,,"algorithm,coding,competitive-programming,data-structure,development,interview,interview-practice,interview-questions,programming,python",0,0,0,NOASSERTION,Python,31149,4628,31149,75,7768,2015-04-28T21:36:39Z,2026-02-05T00:31:51Z,2024-05-08T23:07:36Z,637,0,55,CAUTION,LICENSE_UNCLEAR|NO_COMMIT_365D,"No commits for 637 days and unclear license (NOASSERTION), suggesting the content is stale and legally unclear.",2026-02-05T11:55:10.886032+00:00
ascoders/weekly,https://github.com/ascoders/weekly,å‰ç«¯ç²¾è¯»å‘¨åˆŠã€‚å¸®ä½ ç†è§£æœ€å‰æ²¿ã€å®ç”¨çš„æŠ€æœ¯ã€‚,,"awesome,frontend,weekly",0,0,0,,JavaScript,30828,3281,30828,3,8812,2017-03-20T06:10:04Z,2026-02-05T10:11:04Z,2024-09-09T01:39:37Z,514,0,55,CAUTION,LICENSE_UNCLEAR|NO_COMMIT_365D,"No commits for 514 days and unclear license, indicating the weekly publication has halted and lacks clear licensing.",2026-02-05T11:55:11.252488+00:00
aosabook/500lines,https://github.com/aosabook/500lines,500 Lines or Less,,,0,0,0,NOASSERTION,JavaScript,29609,5859,29609,58,60251,2013-11-04T02:02:53Z,2026-02-05T09:35:51Z,2023-08-19T11:18:34Z,901,0,55,CAUTION,LICENSE_UNCLEAR|NO_COMMIT_365D,"No commits for 901 days and unclear license (NOASSERTION), showing long-term inactivity and legal ambiguity.",2026-02-05T11:55:11.253058+00:00
meta-llama/llama3,https://github.com/meta-llama/llama3,The official Meta Llama 3 GitHub site,,,0,0,0,NOASSERTION,Python,29222,3512,29222,216,569,2024-03-15T17:57:00Z,2026-02-05T08:33:46Z,2025-01-26T21:39:06Z,374,0,55,CAUTION,LICENSE_UNCLEAR|NO_COMMIT_365D,"No commits for 374 days and unclear license (NOASSERTION), indicating stalled development and licensing uncertainty.",2026-02-05T11:55:10.886894+00:00
donnemartin/data-science-ipython-notebooks,https://github.com/donnemartin/data-science-ipython-notebooks,"Data science Python notebooks: Deep learning (TensorFlow, Theano, Caffe, Keras), scikit-learn, Kaggle, big data (Spark, Hadoop MapReduce, HDFS), matplotlib, pandas, NumPy, SciPy, Python essentials, AWS, and various command lines.",,"aws,big-data,caffe,data-science,deep-learning,hadoop,kaggle,keras,machine-learning,mapreduce,matplotlib,numpy,pandas,python,scikit-learn,scipy,spark,tensorflow,theano",0,0,0,NOASSERTION,Python,28847,8041,28847,41,49025,2015-01-23T19:38:29Z,2026-02-05T09:06:44Z,2024-03-20T13:52:34Z,686,0,55,CAUTION,LICENSE_UNCLEAR|NO_COMMIT_365D,"No commits for 686 days and unclear license (NOASSERTION), suggesting outdated content and legal risk.",2026-02-05T11:55:10.886984+00:00
Advanced-Frontend/Daily-Interview-Question,https://github.com/Advanced-Frontend/Daily-Interview-Question,æˆ‘æ˜¯ä¾æ‰¬ï¼ˆæœ¨æ˜“æ¨ï¼‰ï¼Œå…¬ä¼—å·ã€Œé«˜çº§å‰ç«¯è¿›é˜¶ã€ä½œè€…ï¼Œæ¯å¤©æå®šä¸€é“å‰ç«¯å¤§å‚é¢è¯•é¢˜ï¼Œç¥å¤§å®¶å¤©å¤©è¿›æ­¥ï¼Œä¸€å¹´åä¼šçœ‹åˆ°ä¸ä¸€æ ·çš„è‡ªå·±ã€‚,https://muyiy.cn/question/,"css,interview,javascript,react,vue",0,0,0,,JavaScript,27507,3266,27507,266,199,2019-01-19T10:49:00Z,2026-02-05T10:14:03Z,2020-11-09T01:07:00Z,1914,0,55,CAUTION,LICENSE_UNCLEAR|NO_COMMIT_365D,"No commits for 1914 days (over 5 years) and unclear license, indicating complete abandonment.",2026-02-05T11:55:11.254092+00:00
MostlyAdequate/mostly-adequate-guide,https://github.com/MostlyAdequate/mostly-adequate-guide,Mostly adequate guide to FP (in javascript),,"functional-programming,javascript,reactive-programming,tutorial",0,0,0,NOASSERTION,JavaScript,23828,1900,23828,89,5421,2015-05-06T01:44:15Z,2026-02-03T22:45:46Z,2024-09-17T06:18:40Z,506,1,55,CAUTION,LICENSE_UNCLEAR|NO_COMMIT_365D,"No commits for 506 days and unclear license (NOASSERTION), raising concerns about content freshness and legal use.",2026-02-05T11:55:11.376184+00:00
Tencent/wepy,https://github.com/Tencent/wepy,å°ç¨‹åºç»„ä»¶åŒ–å¼€å‘æ¡†æ¶,https://wepyjs.gitee.io/wepy-docs/,"weapp,wepy",0,0,0,NOASSERTION,JavaScript,22661,3041,22661,387,9541,2016-11-14T08:06:56Z,2026-02-04T14:52:24Z,2023-09-19T02:09:28Z,870,0,55,CAUTION,LICENSE_UNCLEAR|NO_COMMIT_365D,"No commits for 870 days and unclear license (NOASSERTION), indicating the framework is not maintained and legally unclear.",2026-02-05T11:55:11.377105+00:00
jlmakes/scrollreveal,https://github.com/jlmakes/scrollreveal,Animate elements as they scroll into view.,https://scrollrevealjs.org/,"animation,css,javascript,reveal,scroll,scrollreveal,transform,transition",0,0,0,,JavaScript,22530,2225,22530,40,1140,2014-01-16T17:37:20Z,2026-02-04T22:25:30Z,2024-04-05T17:55:48Z,670,0,55,CAUTION,LICENSE_UNCLEAR|NO_COMMIT_365D,"No commits for 670 days and unclear license, suggesting the library is unmaintained and lacks clear licensing.",2026-02-05T11:55:11.377232+00:00
pingcap/talent-plan,https://github.com/pingcap/talent-plan,open source training courses about distributed database and distributed systems,https://tidb.io/talent-plan,"distributed-database,distributed-systems,golang,open-source,pingcap,rust,talent-plan",0,0,0,,Rust,10821,1377,10821,127,4110,2019-01-22T01:29:49Z,2026-02-05T06:58:01Z,2023-09-18T11:33:20Z,871,0,55,CAUTION,LICENSE_UNCLEAR|NO_COMMIT_365D,"No commits for 871 days and unclear license, indicating the training plan is outdated and legally ambiguous.",2026-02-05T11:55:12.848144+00:00
XX-net/XX-Net,https://github.com/XX-net/XX-Net,A proxy tool to bypass GFW.,,"gfw,goagent,proxy,uncensored,vpn",0,0,0,,Python,33419,7599,33419,7923,60574,2015-01-15T09:35:51Z,2026-02-05T07:02:47Z,2025-08-26T00:53:05Z,163,0,53,CAUTION,LICENSE_UNCLEAR|NO_COMMIT_90D|ISSUE_PRESSURE_HIGH,"No commits for 163 days and extremely high open issue count of 7923, indicating severe support backlog and potential instability.",2026-02-05T11:55:10.885141+00:00
vuejs/vue,https://github.com/vuejs/vue,"This is the repo for Vue 2. For Vue 3, go to https://github.com/vuejs/core",http://v2.vuejs.org,"framework,frontend,javascript,vue",0,0,0,MIT,TypeScript,209899,33889,209899,620,32152,2013-07-29T03:24:51Z,2026-02-05T09:59:42Z,2024-10-10T07:24:15Z,483,0,45,OK,NO_COMMIT_365D,"No commits for 483 days; 620 open issues, 209899â˜…",2026-02-05T11:55:11.497936+00:00
nvbn/thefuck,https://github.com/nvbn/thefuck,Magnificent app which corrects your previous console command.,,"python,shell",0,0,0,MIT,Python,95405,3832,95405,404,4043,2015-04-08T15:08:04Z,2026-02-05T08:40:36Z,2024-07-19T14:56:13Z,565,0,45,OK,NO_COMMIT_365D,"No commits for 565 days; 404 open issues, 95405â˜…",2026-02-05T11:55:10.517566+00:00
ryanmcdermott/clean-code-javascript,https://github.com/ryanmcdermott/clean-code-javascript,Clean Code concepts adapted for JavaScript,,"best-practices,clean-architecture,clean-code,composition,inheritance,javascript,principles",0,0,0,MIT,JavaScript,94292,12503,94292,119,520,2016-11-25T22:25:41Z,2026-02-05T11:37:23Z,2024-07-29T07:24:37Z,556,0,45,OK,NO_COMMIT_365D,"No commits for 556 days; 119 open issues, 94292â˜…",2026-02-05T11:55:11.007920+00:00
d2l-ai/d2l-zh,https://github.com/d2l-ai/d2l-zh,ã€ŠåŠ¨æ‰‹å­¦æ·±åº¦å­¦ä¹ ã€‹ï¼šé¢å‘ä¸­æ–‡è¯»è€…ã€èƒ½è¿è¡Œã€å¯è®¨è®ºã€‚ä¸­è‹±æ–‡ç‰ˆè¢«70å¤šä¸ªå›½å®¶çš„500å¤šæ‰€å¤§å­¦ç”¨äºæ•™å­¦ã€‚,http://zh.d2l.ai,"book,chinese,computer-vision,deep-learning,machine-learning,natural-language-processing,notebook,python",0,0,0,Apache-2.0,Python,75447,12109,75447,122,316965,2017-08-23T04:40:24Z,2026-02-05T11:28:26Z,2024-07-30T09:32:19Z,555,0,45,OK,NO_COMMIT_365D,"No commits for 555 days; 122 open issues, 75447â˜…",2026-02-05T11:55:10.518175+00:00
FiloSottile/mkcert,https://github.com/FiloSottile/mkcert,A simple zero-config tool to make locally trusted development certificates with any names you'd like.,https://mkcert.dev,"certificates,chrome,firefox,https,ios,linux,local-development,localhost,macos,root-ca,tls,windows",0,0,0,BSD-3-Clause,Go,57956,3047,57956,165,1799,2018-06-25T05:33:03Z,2026-02-05T09:45:02Z,2024-08-13T13:37:46Z,540,0,45,OK,NO_COMMIT_365D,"No commits for 540 days; 165 open issues, 57956â˜…",2026-02-05T11:55:11.989676+00:00
scutan90/DeepLearning-500-questions,https://github.com/scutan90/DeepLearning-500-questions,æ·±åº¦å­¦ä¹ 500é—®ï¼Œä»¥é—®ç­”å½¢å¼å¯¹å¸¸ç”¨çš„æ¦‚ç‡çŸ¥è¯†ã€çº¿æ€§ä»£æ•°ã€æœºå™¨å­¦ä¹ ã€æ·±åº¦å­¦ä¹ ã€è®¡ç®—æœºè§†è§‰ç­‰çƒ­ç‚¹é—®é¢˜è¿›è¡Œé˜è¿°ï¼Œä»¥å¸®åŠ©è‡ªå·±åŠæœ‰éœ€è¦çš„è¯»è€…ã€‚ å…¨ä¹¦åˆ†ä¸º18ä¸ªç« èŠ‚ï¼Œ50ä½™ä¸‡å­—ã€‚ç”±äºæ°´å¹³æœ‰é™ï¼Œä¹¦ä¸­ä¸å¦¥ä¹‹å¤„æ³è¯·å¹¿å¤§è¯»è€…æ‰¹è¯„æŒ‡æ­£ã€‚   æœªå®Œå¾…ç»­............ å¦‚æœ‰æ„åˆä½œï¼Œè”ç³»scutjy2015@163.com                     ç‰ˆæƒæ‰€æœ‰ï¼Œè¿æƒå¿…ç©¶       Tan 2018.06,https://github.com/scutan90/DeepLearning-500-questions,,0,0,0,GPL-3.0,JavaScript,57125,15980,57125,121,207074,2018-06-27T06:36:45Z,2026-02-05T10:22:53Z,2024-06-26T12:10:14Z,588,0,45,OK,NO_COMMIT_365D,"No commits for 588 days; 121 open issues, 57125â˜…",2026-02-05T11:55:11.008764+00:00
zylon-ai/private-gpt,https://github.com/zylon-ai/private-gpt,"Interact with your documents using the power of GPT, 100% privately, no data leaks",https://privategpt.dev,,0,0,0,Apache-2.0,Python,57102,7612,57102,290,2778,2023-05-02T09:15:31Z,2026-02-05T08:57:58Z,2024-11-13T19:30:32Z,448,0,45,OK,NO_COMMIT_365D,"No commits for 448 days; 290 open issues, 57102â˜…",2026-02-05T11:55:10.639975+00:00
ageitgey/face_recognition,https://github.com/ageitgey/face_recognition,The world's simplest facial recognition api for Python and the command line,,"face-detection,face-recognition,machine-learning,python",0,0,0,MIT,Python,56091,13716,56091,832,103959,2017-03-03T21:52:39Z,2026-02-05T10:25:20Z,2024-08-21T06:22:36Z,533,0,45,OK,NO_COMMIT_365D,"No commits for 533 days; 832 open issues, 56091â˜…",2026-02-05T11:55:10.640127+00:00
xai-org/grok-1,https://github.com/xai-org/grok-1,Grok open release,,,0,0,0,Apache-2.0,Python,51461,8494,51461,126,1008,2024-03-17T08:53:38Z,2026-02-05T10:21:46Z,2024-08-30T04:17:25Z,524,0,45,OK,NO_COMMIT_365D,"No commits for 524 days; 126 open issues, 51461â˜…",2026-02-05T11:55:10.640755+00:00
Semantic-Org/Semantic-UI,https://github.com/Semantic-Org/Semantic-UI,Semantic is a UI component framework based around useful principles from natural language.,http://www.semantic-ui.com,"button,css-framework,dropdown,flexbox,popup,semantic,sidebar,tooltip,ui,ui-components",0,0,0,MIT,JavaScript,51162,4913,51162,1074,113201,2013-04-08T23:32:04Z,2026-02-05T02:02:42Z,2024-11-27T21:01:48Z,434,0,45,OK,NO_COMMIT_365D,"No commits for 434 days; 1074 open issues, 51162â˜…",2026-02-05T11:55:11.009123+00:00
agalwood/Motrix,https://github.com/agalwood/Motrix,A full-featured download manager.,https://motrix.app,"aria2,bittorrent,bt,download,download-manager,electron,linux,mac,macos,magnet,motrix,torrent,windows",0,0,0,MIT,JavaScript,50697,4816,50697,771,69808,2018-12-18T11:45:05Z,2026-02-05T11:41:54Z,2024-07-11T12:09:20Z,573,0,45,OK,NO_COMMIT_365D,"No commits for 573 days; 771 open issues, 50697â˜…",2026-02-05T11:55:11.009208+00:00
algorithm-visualizer/algorithm-visualizer,https://github.com/algorithm-visualizer/algorithm-visualizer,:fireworks:Interactive Online Platform that Visualizes Algorithms from Code,https://algorithm-visualizer.org/,"algorithm,animation,data-structure,visualization",0,0,0,MIT,JavaScript,48346,7577,48346,78,21182,2016-05-15T00:27:45Z,2026-02-04T14:19:21Z,2024-06-09T06:54:22Z,606,0,45,OK,NO_COMMIT_365D,"No commits for 606 days; 78 open issues, 48346â˜…",2026-02-05T11:55:11.009378+00:00
moment/moment,https://github.com/moment/moment,"Parse, validate, manipulate, and display dates in javascript.",momentjs.com,,0,0,0,MIT,JavaScript,48079,7025,48079,290,22191,2011-03-01T02:46:06Z,2026-02-04T16:48:34Z,2024-08-14T17:12:19Z,539,0,45,OK,NO_COMMIT_365D,"No commits for 539 days; 290 open issues, 48079â˜…",2026-02-05T11:55:11.009421+00:00
minimaxir/big-list-of-naughty-strings,https://github.com/minimaxir/big-list-of-naughty-strings,The Big List of Naughty Strings is a list of strings which have a high probability of causing issues when used as user-input data.,,,0,0,0,MIT,Python,47578,2164,47578,108,330,2015-08-08T20:57:20Z,2026-02-05T08:20:17Z,2024-04-18T03:26:59Z,658,0,45,OK,NO_COMMIT_365D,"No commits for 658 days; 108 open issues, 47578â˜…",2026-02-05T11:55:10.641056+00:00
vercel/hyper,https://github.com/vercel/hyper,A terminal built on web technologies,https://hyper.is,"css,html,hyper,javascript,linux,macos,react,terminal,terminal-emulators",0,0,0,MIT,TypeScript,44688,3551,44688,1022,24532,2016-07-01T06:01:21Z,2026-02-04T14:19:43Z,2024-08-14T03:32:57Z,540,0,45,OK,NO_COMMIT_365D,"No commits for 540 days; 1022 open issues, 44688â˜…",2026-02-05T11:55:11.621545+00:00
coqui-ai/TTS,https://github.com/coqui-ai/TTS,"ğŸ¸ğŸ’¬ - a deep learning toolkit for Text-to-Speech, battle-tested in research and production",http://coqui.ai,"deep-learning,glow-tts,hifigan,melgan,multi-speaker-tts,python,pytorch,speaker-encoder,speaker-encodings,speech,speech-synthesis,tacotron,text-to-speech,tts,tts-model,vocoder,voice-cloning,voice-conversion,voice-synthesis",0,0,0,MPL-2.0,Python,44460,5949,44460,7,170196,2020-05-20T15:45:28Z,2026-02-05T10:56:21Z,2024-08-16T12:07:14Z,537,0,45,OK,NO_COMMIT_365D,"No commits for 537 days; 7 open issues, 44460â˜…",2026-02-05T11:55:10.641365+00:00
astaxie/build-web-application-with-golang,https://github.com/astaxie/build-web-application-with-golang,A golang ebook intro how to build a web with golang,,,0,0,0,BSD-3-Clause,Go,44188,10548,44188,135,38293,2012-08-02T11:49:35Z,2026-02-05T08:42:44Z,2024-05-12T00:47:46Z,634,0,45,OK,NO_COMMIT_365D,"No commits for 634 days; 135 open issues, 44188â˜…",2026-02-05T11:55:11.990314+00:00
zai-org/ChatGLM-6B,https://github.com/zai-org/ChatGLM-6B,ChatGLM-6B: An Open Bilingual Dialogue Language Model | å¼€æºåŒè¯­å¯¹è¯è¯­è¨€æ¨¡å‹,,,0,0,0,Apache-2.0,Python,41222,5208,41222,602,9362,2023-03-13T12:00:18Z,2026-02-05T07:29:58Z,2024-06-27T04:05:25Z,588,0,45,OK,NO_COMMIT_365D,"No commits for 588 days; 602 open issues, 41222â˜…",2026-02-05T11:55:10.762484+00:00
goabstract/Awesome-Design-Tools,https://github.com/goabstract/Awesome-Design-Tools,The best design tools and plugins for everything ğŸ‘‰,,"animations,awesome,awesome-list,design,design-systems,design-tools,font-awesome,ui-design",0,0,0,MIT,JavaScript,38970,2182,38970,110,19220,2019-02-12T13:55:30Z,2026-02-05T11:37:24Z,2024-07-28T19:57:31Z,556,0,45,OK,NO_COMMIT_365D,"No commits for 556 days; 110 open issues, 38970â˜…",2026-02-05T11:55:11.131022+00:00
