repo_full_name,html_url,description,homepage,topics,archived,disabled,is_fork,license_spdx,language,stars,forks,watchers,open_issues,size_kb,created_at,updated_at,pushed_at,days_since_last_commit,days_since_last_update,risk_score,action,risk_flags,why,updated_at_run
vinta/awesome-python,https://github.com/vinta/awesome-python,"An opinionated list of awesome Python frameworks, libraries, software and resources.",https://awesome-python.com/,"awesome,collections,python,python-framework,python-library,python-resources",0,0,0,NOASSERTION,Python,281523,27179,281523,15,4720,2014-06-27T21:00:06Z,2026-02-05T11:48:17Z,2026-02-02T12:55:06Z,2,0,10,OK,LICENSE_UNCLEAR,"License unclear; Active (last commit 2d ago); 15 open issues, 281523â˜…",2026-02-05T11:55:10.516893+00:00
Significant-Gravitas/AutoGPT,https://github.com/Significant-Gravitas/AutoGPT,"AutoGPT is the vision of accessible AI for everyone, to use and to build on. Our mission is to provide the tools, so that you can focus on what matters.",https://agpt.co,"ai,artificial-intelligence,autonomous-agents,gpt-4,llama-api,openai,python",0,0,0,NOASSERTION,Python,181695,46292,181695,333,333401,2023-03-16T09:21:07Z,2026-02-05T11:35:30Z,2026-02-05T11:51:48Z,0,0,10,OK,LICENSE_UNCLEAR,"License unclear; Active (last commit 0d ago); 333 open issues, 181695â˜…",2026-02-05T11:55:10.516996+00:00
n8n-io/n8n,https://github.com/n8n-io/n8n,"Fair-code workflow automation platform with native AI capabilities. Combine visual building with custom code, self-host or cloud, 400+ integrations.",https://n8n.io,"ai,apis,automation,cli,data-flow,development,integration-framework,integrations,ipaas,low-code,low-code-platform,mcp,mcp-client,mcp-server,n8n,no-code,self-hosted,typescript,workflow,workflow-automation",0,0,0,NOASSERTION,TypeScript,173131,54528,173131,1333,370844,2019-06-22T09:24:21Z,2026-02-05T11:48:12Z,2026-02-05T11:51:40Z,0,0,10,OK,LICENSE_UNCLEAR,"License unclear; Active (last commit 0d ago); 1333 open issues, 173131â˜…",2026-02-05T11:55:11.498059+00:00
521xueweihan/HelloGitHub,https://github.com/521xueweihan/HelloGitHub,":octocat: åˆ†äº« GitHub ä¸Šæœ‰è¶£ã€å…¥é—¨çº§çš„å¼€æºé¡¹ç›®ã€‚Share interesting, entry-level open source projects on GitHub.",https://hellogithub.com,"awesome,github,hellogithub,python",0,0,0,,Python,142235,11102,142235,262,8845,2016-05-04T06:24:11Z,2026-02-05T11:30:20Z,2026-01-28T01:25:45Z,8,0,10,OK,LICENSE_UNCLEAR,"License unclear; Active (last commit 8d ago); 262 open issues, 142235â˜…",2026-02-05T11:55:10.517251+00:00
langgenius/dify,https://github.com/langgenius/dify,Production-ready platform for agentic workflow development.,https://dify.ai,"agent,agentic-ai,agentic-framework,agentic-workflow,ai,automation,gemini,genai,gpt,gpt-4,llm,low-code,mcp,nextjs,no-code,openai,orchestration,python,rag,workflow",0,0,0,NOASSERTION,TypeScript,128790,20038,128790,731,294161,2023-04-12T07:40:24Z,2026-02-05T11:51:20Z,2026-02-05T11:33:13Z,0,0,10,OK,LICENSE_UNCLEAR,"License unclear; Active (last commit 0d ago); 731 open issues, 128790â˜…",2026-02-05T11:55:11.498242+00:00
open-webui/open-webui,https://github.com/open-webui/open-webui,"User-friendly AI Interface (Supports Ollama, OpenAI API, ...)",https://openwebui.com,"ai,llm,llm-ui,llm-webui,llms,mcp,ollama,ollama-webui,open-webui,openai,openapi,rag,self-hosted,ui,webui",0,0,0,NOASSERTION,Python,122989,17368,122989,296,317589,2023-10-06T22:08:27Z,2026-02-05T11:38:58Z,2026-02-05T06:24:14Z,0,0,10,OK,LICENSE_UNCLEAR,"License unclear; Active (last commit 0d ago); 296 open issues, 122989â˜…",2026-02-05T11:55:10.517390+00:00
nodejs/node,https://github.com/nodejs/node,Node.js JavaScript runtime âœ¨ğŸ¢ğŸš€âœ¨,https://nodejs.org,"javascript,js,linux,macos,mit,node,nodejs,runtime,windows",0,0,0,NOASSERTION,JavaScript,115564,34620,115564,2448,1414330,2014-11-26T19:57:11Z,2026-02-05T11:37:39Z,2026-02-05T08:48:27Z,0,0,10,OK,LICENSE_UNCLEAR,"License unclear; Active (last commit 0d ago); 2448 open issues, 115564â˜…",2026-02-05T11:55:11.007584+00:00
bregman-arie/devops-exercises,https://github.com/bregman-arie/devops-exercises,"Linux, Jenkins, AWS, SRE, Prometheus, Docker, Python, Ansible, Git, Kubernetes, Terraform, OpenStack, SQL, NoSQL, Azure, GCP, DNS, Elastic, Network, Virtualization. DevOps Interview Questions",,"ansible,aws,azure,coding,containers,devops,docker,git,interview,interview-questions,kubernetes,linux,openstack,production-engineer,prometheus,python,sql,sre,terraform",0,0,0,NOASSERTION,Python,80865,18484,80865,35,8007,2019-10-03T17:31:21Z,2026-02-05T10:27:23Z,2025-12-27T14:22:30Z,39,0,10,OK,LICENSE_UNCLEAR,"License unclear; Active (last commit 39d ago); 35 open issues, 80865â˜…",2026-02-05T11:55:10.517958+00:00
modelcontextprotocol/servers,https://github.com/modelcontextprotocol/servers,Model Context Protocol Servers,https://modelcontextprotocol.io,,0,0,0,NOASSERTION,TypeScript,78043,9443,78043,295,28377,2024-11-19T01:10:17Z,2026-02-05T11:32:11Z,2026-02-05T03:20:35Z,0,0,10,OK,LICENSE_UNCLEAR,"License unclear; Active (last commit 0d ago); 295 open issues, 78043â˜…",2026-02-05T11:55:11.499253+00:00
tensorflow/models,https://github.com/tensorflow/models,Models and examples built with TensorFlow,,,0,0,0,NOASSERTION,Python,77688,45311,77688,1274,658681,2016-02-05T01:15:20Z,2026-02-05T05:05:02Z,2026-02-05T05:04:25Z,0,0,10,OK,LICENSE_UNCLEAR,"License unclear; Active (last commit 0d ago); 1274 open issues, 77688â˜…",2026-02-05T11:55:10.518132+00:00
FortAwesome/Font-Awesome,https://github.com/FortAwesome/Font-Awesome,"The iconic SVG, font, and CSS toolkit",https://fontawesome.com,"css,font,fontawesome,icons,svg-icons,svg-sprites,webfont",0,0,0,NOASSERTION,JavaScript,76299,12252,76299,310,138845,2012-02-17T14:19:43Z,2026-02-05T11:13:51Z,2025-12-12T16:04:31Z,54,0,10,OK,LICENSE_UNCLEAR,"License unclear; Active (last commit 54d ago); 310 open issues, 76299â˜…",2026-02-05T11:55:11.008097+00:00
typicode/json-server,https://github.com/typicode/json-server,Get a full fake REST API with zero coding in less than 30 seconds (seriously),,,0,0,0,NOASSERTION,JavaScript,75626,7271,75626,708,4209,2013-11-27T13:21:13Z,2026-02-05T09:20:01Z,2026-01-29T01:13:35Z,7,0,10,OK,LICENSE_UNCLEAR,"License unclear; Active (last commit 7d ago); 708 open issues, 75626â˜…",2026-02-05T11:55:11.008145+00:00
Stirling-Tools/Stirling-PDF,https://github.com/Stirling-Tools/Stirling-PDF,#1 PDF Application on GitHub that lets you edit PDFs on any device anywhere,https://stirling.com,"docker,hacktoberfest,java,pdf,pdf-converter,pdf-editor,pdf-manipulation,pdf-merger,pdf-ocr,pdf-tools,pdf-web-apps,pdfmerger",0,0,0,NOASSERTION,TypeScript,73802,6283,73802,409,230677,2023-01-27T18:22:42Z,2026-02-05T11:54:21Z,2026-02-05T09:56:36Z,0,0,10,OK,LICENSE_UNCLEAR,"License unclear; Active (last commit 0d ago); 409 open issues, 73802â˜…",2026-02-05T11:55:11.499470+00:00
lobehub/lobehub,https://github.com/lobehub/lobehub,"The ultimate space for work and life â€” to find, build, and collaborate with agent teammates that grow with you. We are taking agent harness to the next level â€” enabling multi-agent collaboration, effortless agent team design, and introducing agents as the unit of work interaction.",https://lobehub.com,"agent,agent-collaboration,agent-harness,ai,chatgpt,claude,deepseek,gemini,gpt,knowledge-base,mcp,openai",0,0,0,NOASSERTION,TypeScript,71958,14599,71958,885,668168,2023-05-21T07:19:12Z,2026-02-05T11:52:53Z,2026-02-05T11:42:57Z,0,0,10,OK,LICENSE_UNCLEAR,"License unclear; Active (last commit 0d ago); 885 open issues, 71958â˜…",2026-02-05T11:55:11.499559+00:00
josephmisiti/awesome-machine-learning,https://github.com/josephmisiti/awesome-machine-learning,"A curated list of awesome Machine Learning frameworks, libraries and software.",,,0,0,0,NOASSERTION,Python,71591,15299,71591,8,2883,2014-07-15T19:11:19Z,2026-02-05T11:41:46Z,2026-01-29T18:16:50Z,6,0,10,OK,LICENSE_UNCLEAR,"License unclear; Active (last commit 6d ago); 8 open issues, 71591â˜…",2026-02-05T11:55:10.518355+00:00
strapi/strapi,https://github.com/strapi/strapi,"ğŸš€ Strapi is the leading open-source headless CMS. Itâ€™s 100% JavaScript/TypeScript, fully customizable, and developer-first.",https://strapi.io,"api,cms,cms-framework,content-management,content-management-system,customizable,dashboard,graphql,hacktoberfest,headless-cms,jamstack,javascript,koa,koa2,mysql,no-code,nodejs,rest,strapi,typescript",0,0,0,NOASSERTION,TypeScript,71211,9465,71211,763,616104,2015-09-30T15:34:48Z,2026-02-05T11:45:32Z,2026-02-05T10:57:59Z,0,0,10,OK,LICENSE_UNCLEAR,"License unclear; Active (last commit 0d ago); 763 open issues, 71211â˜…",2026-02-05T11:55:11.499644+00:00
OpenHands/OpenHands,https://github.com/OpenHands/OpenHands,ğŸ™Œ OpenHands: AI-Driven Development,https://openhands.dev,"agent,artificial-intelligence,chatgpt,claude-ai,cli,developer-tools,gpt,llm,openai",0,0,0,NOASSERTION,Python,67513,8401,67513,309,274016,2024-03-13T03:33:31Z,2026-02-05T11:51:05Z,2026-02-05T10:43:02Z,0,0,10,OK,LICENSE_UNCLEAR,"License unclear; Active (last commit 0d ago); 309 open issues, 67513â˜…",2026-02-05T11:55:10.518693+00:00
localstack/localstack,https://github.com/localstack/localstack,ğŸ’» A fully functional local AWS cloud stack. Develop and test your cloud & Serverless apps offline,https://localstack.cloud,"aws,cloud,continuous-integration,developer-tools,localstack,python,testing",0,0,0,NOASSERTION,Python,64292,4517,64292,368,62262,2016-10-25T23:48:03Z,2026-02-05T10:30:55Z,2026-02-05T10:55:56Z,0,0,10,OK,LICENSE_UNCLEAR,"License unclear; Active (last commit 0d ago); 368 open issues, 64292â˜…",2026-02-05T11:55:10.518935+00:00
anthropics/skills,https://github.com/anthropics/skills,Public repository for Agent Skills,,agent-skills,0,0,0,,Python,63656,6278,63656,238,3099,2025-09-22T15:53:31Z,2026-02-05T11:52:58Z,2026-02-04T02:20:55Z,1,0,10,OK,LICENSE_UNCLEAR,"License unclear; Active (last commit 1d ago); 238 open issues, 63656â˜…",2026-02-05T11:55:10.639313+00:00
toeverything/AFFiNE,https://github.com/toeverything/AFFiNE,"There can be more than Notion and Miro. AFFiNE(pronounced [É™â€˜fain]) is a next-gen knowledge base that brings planning, sorting and creating all together. Privacy first, open-source, customizable and ready to use. ",https://affine.pro,"app,crdt,editor,electron,knowledge-base,markdown,miro,notes,notion,notion-alternative,rust,rust-lang,rust-language,table,tableview,whiteboard,wiki,workspace",0,0,0,NOASSERTION,TypeScript,62559,4362,62559,569,563848,2022-07-31T18:45:21Z,2026-02-05T11:23:08Z,2026-02-05T10:04:48Z,0,0,10,OK,LICENSE_UNCLEAR,"License unclear; Active (last commit 0d ago); 569 open issues, 62559â˜…",2026-02-05T11:55:11.499922+00:00
nocodb/nocodb,https://github.com/nocodb/nocodb,ğŸ”¥ ğŸ”¥ ğŸ”¥ A Free & Self-hostable Airtable Alternative,https://nocodb.com,"airtable,airtable-alternative,automatic-api,hacktoberfest,low-code,no-code,no-code-database,no-code-platform,postgresql,rest-api,restful-api,spreadsheet,sqlite,swagger",0,0,0,NOASSERTION,TypeScript,61869,4619,61869,559,1409535,2017-10-29T18:51:48Z,2026-02-05T10:30:42Z,2026-02-05T11:06:55Z,0,0,10,OK,LICENSE_UNCLEAR,"License unclear; Active (last commit 0d ago); 559 open issues, 61869â˜…",2026-02-05T11:55:11.499964+00:00
lodash/lodash,https://github.com/lodash/lodash,"A modern JavaScript utility library delivering modularity, performance, & extras.",https://lodash.com/,"javascript,lodash,modules,utilities",0,0,0,NOASSERTION,JavaScript,61606,7121,61606,106,49640,2012-04-07T04:11:46Z,2026-02-05T11:28:28Z,2026-02-02T09:04:23Z,3,0,10,OK,LICENSE_UNCLEAR,"License unclear; Active (last commit 3d ago); 106 open issues, 61606â˜…",2026-02-05T11:55:11.008489+00:00
OpenBB-finance/OpenBB,https://github.com/OpenBB-finance/OpenBB,"Financial data platform for analysts, quants and AI agents.",https://openbb.co,"ai,crypto,derivatives,economics,equity,finance,fixed-income,machine-learning,openbb,options,python,quantitative-finance,stocks",0,0,0,NOASSERTION,Python,59855,5835,59855,53,2407941,2020-12-20T10:46:38Z,2026-02-05T10:18:46Z,2026-02-04T22:55:36Z,0,0,10,OK,LICENSE_UNCLEAR,"License unclear; Active (last commit 0d ago); 53 open issues, 59855â˜…",2026-02-05T11:55:10.639518+00:00
CorentinJ/Real-Time-Voice-Cloning,https://github.com/CorentinJ/Real-Time-Voice-Cloning,Clone a voice in 5 seconds to generate arbitrary speech in real-time,,"deep-learning,python,pytorch,tensorflow,tts,voice-cloning",0,0,0,NOASSERTION,Python,59306,9412,59306,169,369728,2019-05-26T08:56:15Z,2026-02-05T11:26:19Z,2025-12-15T12:47:13Z,51,0,10,OK,LICENSE_UNCLEAR,"License unclear; Active (last commit 51d ago); 169 open issues, 59306â˜…",2026-02-05T11:55:10.639683+00:00
pathwaycom/pathway,https://github.com/pathwaycom/pathway,"Python ETL framework for stream processing, real-time analytics, LLM pipelines, and RAG.",https://pathway.com,"batch-processing,data-analytics,data-pipelines,data-processing,dataflow,etl,etl-framework,iot-analytics,kafka,machine-learning-algorithms,pathway,python,real-time,rust,stream-processing,streaming,time-series-analysis",0,0,0,NOASSERTION,Python,59278,1586,59278,28,138742,2022-11-27T13:01:14Z,2026-02-05T11:26:58Z,2026-02-05T10:40:05Z,0,0,10,OK,LICENSE_UNCLEAR,"License unclear; Active (last commit 0d ago); 28 open issues, 59278â˜…",2026-02-05T11:55:10.639795+00:00
FuelLabs/fuel-core,https://github.com/FuelLabs/fuel-core,Rust full node implementation of the Fuel v2 protocol.,,"blockchain,fuel",0,0,0,NOASSERTION,Rust,57384,2860,57384,180,910191,2020-08-27T21:12:14Z,2026-02-05T08:55:25Z,2026-02-04T18:17:56Z,0,0,10,OK,LICENSE_UNCLEAR,"License unclear; Active (last commit 0d ago); 180 open issues, 57384â˜…",2026-02-05T11:55:12.480124+00:00
Asabeneh/30-Days-Of-Python,https://github.com/Asabeneh/30-Days-Of-Python,The 30 Days of Python programming challenge is a step-by-step guide to learn the Python programming language in 30 days. This challenge may take more than 100 days. Follow your own pace. These videos may help too: https://www.youtube.com/channel/UC7PNRuno1rzYPb1xLa4yktw,,"30-days-of-python,data,data-science,database,flask,fullstack,github,heroku,matplotlib,ml,mongodb,numpy,pandas,python,python3",0,0,0,,Python,57283,10964,57283,83,30603,2019-11-19T17:24:16Z,2026-02-05T10:22:29Z,2026-01-23T07:32:40Z,13,0,10,OK,LICENSE_UNCLEAR,"License unclear; Active (last commit 13d ago); 83 open issues, 57283â˜…",2026-02-05T11:55:10.639920+00:00
withastro/astro,https://github.com/withastro/astro,The web framework for content-driven websites. â­ï¸ Star to support our work!,https://astro.build,"astro,blog,browser,components,hybrid,islands,node,server,static,static-site-generator,universal",0,0,0,NOASSERTION,TypeScript,56538,3125,56538,222,219689,2021-03-15T17:19:47Z,2026-02-05T11:07:34Z,2026-02-05T11:28:07Z,0,0,10,OK,LICENSE_UNCLEAR,"License unclear; Active (last commit 0d ago); 222 open issues, 56538â˜…",2026-02-05T11:55:11.500175+00:00
meilisearch/meilisearch,https://github.com/meilisearch/meilisearch,A lightning-fast search engine API bringing AI-powered hybrid search to your sites and applications.,https://www.meilisearch.com,"ai,api,app-search,database,enterprise-search,faceting,full-text-search,fuzzy-search,geosearch,hybrid-search,instantsearch,search,search-as-you-type,search-engine,semantic-search,site-search,typo-tolerance,vector-database,vector-search,vectors",0,0,0,NOASSERTION,Rust,55751,2363,55751,296,86852,2018-04-23T11:45:28Z,2026-02-05T09:28:02Z,2026-02-05T10:38:51Z,0,0,10,OK,LICENSE_UNCLEAR,"License unclear; Active (last commit 0d ago); 296 open issues, 55751â˜…",2026-02-05T11:55:12.480217+00:00
laurent22/joplin,https://github.com/laurent22/joplin,"Joplin - the privacy-focused note taking app with sync capabilities for Windows, macOS, Linux, Android and iOS.",https://joplinapp.org,"android,dropbox,electron,enex-files,evernote,javascript,joplin,nextcloud,nodejs,note-taking,onedrive,react-native,synchronisation,web-clipper,webdav",0,0,0,NOASSERTION,TypeScript,53321,5711,53321,645,615291,2017-01-16T21:49:41Z,2026-02-05T11:53:59Z,2026-02-05T00:11:51Z,0,0,10,OK,LICENSE_UNCLEAR,"License unclear; Active (last commit 0d ago); 645 open issues, 53321â˜…",2026-02-05T11:55:11.620546+00:00
DefinitelyTyped/DefinitelyTyped,https://github.com/DefinitelyTyped/DefinitelyTyped,The repository for high quality TypeScript type definitions.,,"definition,dts,hacktoberfest,types,typescript,typescript-definitions,typings",0,0,0,NOASSERTION,TypeScript,50911,30554,50911,690,807173,2012-10-05T16:39:45Z,2026-02-05T10:05:28Z,2026-02-05T10:04:54Z,0,0,10,OK,LICENSE_UNCLEAR,"License unclear; Active (last commit 0d ago); 690 open issues, 50911â˜…",2026-02-05T11:55:11.620817+00:00
FlowiseAI/Flowise,https://github.com/FlowiseAI/Flowise,"Build AI Agents, Visually",https://flowiseai.com,"agentic-ai,agentic-workflow,agents,artificial-intelligence,chatbot,chatgpt,javascript,langchain,large-language-models,low-code,multiagent-systems,no-code,openai,rag,react,typescript,workflow-automation",0,0,0,NOASSERTION,TypeScript,48830,23648,48830,767,71642,2023-03-31T12:23:09Z,2026-02-05T10:13:04Z,2026-02-05T10:09:27Z,0,0,10,OK,LICENSE_UNCLEAR,"License unclear; Active (last commit 0d ago); 767 open issues, 48830â˜…",2026-02-05T11:55:11.620936+00:00
bigskysoftware/htmx,https://github.com/bigskysoftware/htmx,</> htmx - high power tools for HTML,https://htmx.org,"hateoas,html,htmx,hyperscript,javascript,rest",0,0,0,NOASSERTION,JavaScript,47360,1565,47360,658,127529,2020-04-13T16:17:51Z,2026-02-05T10:21:42Z,2026-02-05T03:10:26Z,0,0,10,OK,LICENSE_UNCLEAR,"License unclear; Active (last commit 0d ago); 658 open issues, 47360â˜…",2026-02-05T11:55:11.009464+00:00
serverless/serverless,https://github.com/serverless/serverless,"âš¡ Serverless Framework â€“ Effortlessly build apps that auto-scale, incur zero costs when idle, and require minimal maintenance using AWS Lambda and other managed cloud services.",https://serverless.com,"aws,aws-dynamodb,aws-lambda,azure-functions,google-cloud-functions,microservice,serverless,serverless-architectures,serverless-framework",0,0,0,NOASSERTION,JavaScript,46949,5739,46949,1218,103260,2015-04-21T03:48:40Z,2026-02-04T23:23:25Z,2026-02-04T20:55:21Z,0,0,10,OK,LICENSE_UNCLEAR,"License unclear; Active (last commit 0d ago); 1218 open issues, 46949â˜…",2026-02-05T11:55:11.009507+00:00
Asabeneh/30-Days-Of-JavaScript,https://github.com/Asabeneh/30-Days-Of-JavaScript,"30 days of JavaScript programming challenge is a step-by-step guide to learn JavaScript programming language in 30 days. This challenge may take more than 100 days,  please just follow your own pace. These videos may help too: https://www.youtube.com/channel/UC7PNRuno1rzYPb1xLa4yktw",,"30daysofjavascript,angular,challenge,css,d3,d3js,html,javascript,javascript-for-everyone,js,json,node,nodejs,programming,react,redux,typescript,vue,webdevelopment,website",0,0,0,,JavaScript,46036,10415,46036,366,124993,2019-12-23T14:07:40Z,2026-02-05T10:43:38Z,2025-12-06T11:12:48Z,61,0,10,OK,LICENSE_UNCLEAR,"License unclear; Active (last commit 61d ago); 366 open issues, 46036â˜…",2026-02-05T11:55:11.129807+00:00
virattt/ai-hedge-fund,https://github.com/virattt/ai-hedge-fund,An AI Hedge Fund Team,,,0,0,0,,Python,45613,7996,45613,51,3024,2024-11-29T16:30:01Z,2026-02-05T11:49:43Z,2026-02-02T20:45:33Z,2,0,10,OK,LICENSE_UNCLEAR,"License unclear; Active (last commit 2d ago); 51 open issues, 45613â˜…",2026-02-05T11:55:10.641272+00:00
tldraw/tldraw,https://github.com/tldraw/tldraw,very good whiteboard infinite canvas SDK,https://tldraw.dev,"canvas,collaboration,design,diagram,drawing,infinite,multiplayer,react,sdk,sketch,sync,whiteboard",0,0,0,NOASSERTION,TypeScript,45057,2954,45057,302,1027092,2021-05-09T11:48:37Z,2026-02-05T11:48:30Z,2026-02-05T10:37:44Z,0,0,10,OK,LICENSE_UNCLEAR,"License unclear; Active (last commit 0d ago); 302 open issues, 45057â˜…",2026-02-05T11:55:11.621459+00:00
meteor/meteor,https://github.com/meteor/meteor,"Meteor, the JavaScript App Platform",https://meteor.com,"build-system,framework,hacktoberfest,javascript,meteor,mongodb,nodejs,npm,react,reactive-programming,realtime,rpc,zero-configuration",0,0,0,NOASSERTION,JavaScript,44772,5264,44772,331,143010,2012-01-19T01:58:17Z,2026-02-04T13:09:42Z,2026-02-05T11:19:02Z,0,0,10,OK,LICENSE_UNCLEAR,"License unclear; Active (last commit 0d ago); 331 open issues, 44772â˜…",2026-02-05T11:55:11.130085+00:00
NanmiCoder/MediaCrawler,https://github.com/NanmiCoder/MediaCrawler,å°çº¢ä¹¦ç¬”è®° | è¯„è®ºçˆ¬è™«ã€æŠ–éŸ³è§†é¢‘ | è¯„è®ºçˆ¬è™«ã€å¿«æ‰‹è§†é¢‘ | è¯„è®ºçˆ¬è™«ã€B ç«™è§†é¢‘ ï½œ è¯„è®ºçˆ¬è™«ã€å¾®åšå¸–å­ ï½œ è¯„è®ºçˆ¬è™«ã€ç™¾åº¦è´´å§å¸–å­ ï½œ ç™¾åº¦è´´å§è¯„è®ºå›å¤çˆ¬è™«  | çŸ¥ä¹é—®ç­”æ–‡ç« ï½œè¯„è®ºçˆ¬è™«,https://nanmicoder.github.io/MediaCrawler/,,0,0,0,NOASSERTION,Python,43637,9612,43637,128,28699,2023-06-09T12:14:34Z,2026-02-05T11:35:46Z,2026-02-04T10:03:23Z,1,0,10,OK,LICENSE_UNCLEAR,"License unclear; Active (last commit 1d ago); 128 open issues, 43637â˜…",2026-02-05T11:55:10.641497+00:00
SimplifyJobs/Summer2026-Internships,https://github.com/SimplifyJobs/Summer2026-Internships,Collection of Summer 2026 tech internships!,https://swelist.com/,"internships,interview-preparation,jobs,university",0,0,0,,Python,43310,3164,43310,2,1882767,2020-05-23T20:53:18Z,2026-02-05T11:31:36Z,2026-02-05T11:31:31Z,0,0,10,OK,LICENSE_UNCLEAR,"License unclear; Active (last commit 0d ago); 2 open issues, 43310â˜…",2026-02-05T11:55:10.641580+00:00
Unitech/pm2,https://github.com/Unitech/pm2,Node.js Production Process Manager with a built-in Load Balancer.,https://pm2.keymetrics.io/docs/usage/quick-start/,"command-line,command-line-tool,deploy,load-balancer,monitoring,node,nodejs,pm2,process-manager,production",0,0,0,NOASSERTION,JavaScript,42914,2677,42914,1080,13627,2013-05-21T03:25:25Z,2026-02-05T01:54:57Z,2025-11-26T10:24:50Z,71,0,10,OK,LICENSE_UNCLEAR,"License unclear; Active (last commit 71d ago); 1080 open issues, 42914â˜…",2026-02-05T11:55:11.130366+00:00
faif/python-patterns,https://github.com/faif/python-patterns,A collection of design patterns/idioms in Python,,"design-patterns,idioms,python",0,0,0,,Python,42726,7064,42726,14,3865,2012-06-06T21:02:35Z,2026-02-04T19:01:44Z,2026-01-21T18:49:51Z,14,0,10,OK,LICENSE_UNCLEAR,"License unclear; Active (last commit 14d ago); 14 open issues, 42726â˜…",2026-02-05T11:55:10.641665+00:00
vuetifyjs/vuetify,https://github.com/vuetifyjs/vuetify,ğŸ‰ Vue Component Framework,https://vuetifyjs.com,"javascript,material,material-components,material-design,material-theme,semantic,typescript,ui,ui-components,ui-design,ui-kit,ui-library,vue,vue-components,vue-material,vuejs,vuejs3,vuetify,vuetifyjs",0,0,0,NOASSERTION,TypeScript,40937,7145,40937,671,100272,2016-09-12T00:39:35Z,2026-02-05T08:34:29Z,2026-02-04T20:58:57Z,0,0,10,OK,LICENSE_UNCLEAR,"License unclear; Active (last commit 0d ago); 671 open issues, 40937â˜…",2026-02-05T11:55:11.622216+00:00
janhq/jan,https://github.com/janhq/jan,Jan is an open source alternative to ChatGPT that runs 100% offline on your computer.,https://jan.ai/,"chatgpt,gpt,llamacpp,llm,localai,open-source,self-hosted,tauri",0,0,0,NOASSERTION,TypeScript,40323,2509,40323,234,1472097,2023-08-17T02:17:10Z,2026-02-05T11:46:45Z,2026-02-05T10:40:07Z,0,0,10,OK,LICENSE_UNCLEAR,"License unclear; Active (last commit 0d ago); 234 open issues, 40323â˜…",2026-02-05T11:55:11.622303+00:00
calcom/cal.com,https://github.com/calcom/cal.com,Scheduling infrastructure for absolutely everyone.,https://cal.com,"next-auth,nextjs,open-source,postgresql,prisma,t3-stack,tailwindcss,trpc,turborepo,typescript,zod",0,0,0,NOASSERTION,TypeScript,40043,11790,40043,1370,1118489,2021-03-22T13:47:42Z,2026-02-05T11:20:14Z,2026-02-05T11:44:17Z,0,0,10,OK,LICENSE_UNCLEAR,"License unclear; Active (last commit 0d ago); 1370 open issues, 40043â˜…",2026-02-05T11:55:11.622391+00:00
videojs/video.js,https://github.com/videojs/video.js,Video.js - open source HTML5 video player,https://videojs.com,"dash,hls,html,html5,html5-audio,html5-video,javascript,player,video,video-player,videojs",0,0,0,NOASSERTION,JavaScript,39477,7520,39477,632,127619,2010-05-14T18:45:10Z,2026-02-05T10:59:14Z,2026-02-05T11:13:18Z,0,0,10,OK,LICENSE_UNCLEAR,"License unclear; Active (last commit 0d ago); 632 open issues, 39477â˜…",2026-02-05T11:55:11.130816+00:00
twentyhq/twenty,https://github.com/twentyhq/twenty,"Building a modern alternative to Salesforce, powered by the community.",https://twenty.com,"crm,crm-system,customer,good-first-issue,graphql,hacktoberfest,javascript,marketing,monorepo,nestjs,open-source,postgresql,react,reactjs,sales,typescript,web",0,0,0,NOASSERTION,TypeScript,39227,5072,39227,249,737535,2022-12-01T13:04:40Z,2026-02-05T10:51:52Z,2026-02-05T11:53:46Z,0,0,10,OK,LICENSE_UNCLEAR,"License unclear; Active (last commit 0d ago); 249 open issues, 39227â˜…",2026-02-05T11:55:11.622515+00:00
photoprism/photoprism,https://github.com/photoprism/photoprism,AI-Powered Photos App for the Decentralized Web ğŸŒˆğŸ’âœ¨,https://www.photoprism.app,"ai,golang,google-photos,machine-learning,photography,private-cloud,self-hosted,tensorflow",0,0,0,NOASSERTION,Go,39211,2205,39211,444,323481,2018-01-27T12:00:15Z,2026-02-05T09:55:07Z,2026-02-05T09:19:36Z,0,0,10,OK,LICENSE_UNCLEAR,"License unclear; Active (last commit 0d ago); 444 open issues, 39211â˜…",2026-02-05T11:55:11.990671+00:00
